<?xml version="1.0" encoding="UTF-8"?>
<!DOCTYPE portfolio SYSTEM "portfolio.dtd">
<portfolio>
    <personal>
        <name>Dmytro Palahin</name>
        <title>Full-Stack Developer</title>
        <summary>Passionate developer with expertise in modern web technologies, creating innovative
            solutions and beautiful user experiences.</summary>
        <avatar>src/assets/img/memoji.png</avatar>
    </personal>

    <skills>
        <skill level="expert" category="frontend">JavaScript</skill>
        <skill level="expert" category="frontend">TypeScript</skill>
        <skill level="advanced" category="frontend">React</skill>
        <skill level="advanced" category="frontend">Vue.js</skill>
        <skill level="intermediate" category="backend">Node.js</skill>
        <skill level="intermediate" category="backend">Python</skill>
        <skill level="advanced" category="database">PostgreSQL</skill>
        <skill level="intermediate" category="database">MongoDB</skill>
        <skill level="advanced" category="tools">Git</skill>
        <skill level="intermediate" category="tools">Docker</skill>
        <skill level="expert" category="markup">HTML/CSS</skill>
        <skill level="advanced" category="markup">XML/XSLT</skill>
    </skills>

    <projects>
        <project>
            <name>E-Commerce Platform</name>
            <description>Modern e-commerce solution with real-time inventory management and payment
                integration.</description>
            <technologies>
                <tech>React</tech>
                <tech>Node.js</tech>
                <tech>PostgreSQL</tech>
                <tech>Stripe API</tech>
            </technologies>
            <link>https://example-ecommerce.com</link>
            <github>https://github.com/dmytropalahin/ecommerce-platform</github>
        </project>
        <project>
            <name>Portfolio Website</name>
            <description>Interactive portfolio built with XML/XSLT transformation and modern
                JavaScript.</description>
            <technologies>
                <tech>XML</tech>
                <tech>XSLT</tech>
                <tech>TypeScript</tech>
                <tech>CSS3</tech>
            </technologies>
            <github>https://github.com/dmytropalahin/portfolio</github>
        </project>
        <project>
            <name>Task Management App</name>
            <description>Collaborative task management application with real-time updates and team
                features.</description>
            <technologies>
                <tech>Vue.js</tech>
                <tech>Express.js</tech>
                <tech>Socket.io</tech>
                <tech>MongoDB</tech>
            </technologies>
            <link>https://task-manager-demo.com</link>
            <github>https://github.com/dmytropalahin/task-manager</github>
        </project>
    </projects>

    <experience>
        <job>
            <company>Tech Solutions Inc.</company>
            <position>Frontend Developer</position>
            <period>2022 - Present</period>
            <description>Developing modern web applications using React and TypeScript.
                Collaborating with design teams to create intuitive user interfaces.</description>
        </job>
        <job>
            <company>Digital Agency Pro</company>
            <position>Junior Developer</position>
            <period>2021 - 2022</period>
            <description>Built responsive websites and web applications. Worked with various CMS
                platforms and e-commerce solutions.</description>
        </job>
        <job>
            <company>Freelance</company>
            <position>Web Developer</position>
            <period>2020 - 2021</period>
            <description>Created custom websites for small businesses. Specialized in modern
                JavaScript frameworks and responsive design.</description>
        </job>
    </experience>

    <education>
        <degree>
            <institution>Technical University</institution>
            <program>Computer Science</program>
            <year>2019-2023</year>
        </degree>
    </education>

    <contact>
        <email>dmytro.palahin@example.com</email>
        <phone>+380123456789</phone>
        <linkedin>https://linkedin.com/in/dmytropalahin</linkedin>
        <github>https://github.com/dmytropalahin</github>
    </contact>
</portfolio>